{
  "registry_version": "1.0.0",
  "operational_agents": 1,
  "real_subagents": 0,
  "responsibilities": [
    {
      "role_id": "ORCHESTRATION",
      "contract_type": "BASE_RESPONSIBILITY",
      "functional_owner": "TECHNICAL_GOVERNANCE",
      "purpose": "Coordinar el flujo y sus gates.",
      "when_used": "Al iniciar y cerrar cada handoff.",
      "inputs": [
        "mission_context",
        "artifacts"
      ],
      "outputs": [
        "execution_plan",
        "handoff_record"
      ],
      "read_permissions": [
        "contracts",
        "statuses"
      ],
      "write_permissions": [
        "operational_state",
        "handoff_record"
      ],
      "forbidden_actions": [
        "aprobar contenido editorial",
        "crear subagentes reales"
      ],
      "veto_conditions": [
        "input obligatorio ausente",
        "estado incoherente"
      ],
      "evidence": [
        "gate result",
        "handoff record"
      ],
      "handoff": [
        "entrega a la siguiente responsabilidad"
      ],
      "prompt_version": "1.0.0"
    },
    {
      "role_id": "RESEARCH_AND_CURATION",
      "contract_type": "BASE_RESPONSIBILITY",
      "functional_owner": "SCRIPT_PRODUCT",
      "purpose": "Investigar, verificar y seleccionar fuentes y obras.",
      "when_used": "Durante investigación y curación.",
      "inputs": [
        "topic",
        "source_access",
        "brief",
        "channel_context"
      ],
      "outputs": [
        "ResearchPlanProposal",
        "research_pack",
        "research_comparison",
        "claims_ledger",
        "refined_thesis"
      ],
      "read_permissions": [
        "source material",
        "brief"
      ],
      "write_permissions": [
        "research artifacts"
      ],
      "forbidden_actions": [
        "inventar fuentes",
        "redactar el guion final",
        "decidir función narrativa, orden o progresión del guion",
        "tratar NarrativeHumanAnalysis o MaterialCuration legacy como autoridad de Research V2"
      ],
      "veto_conditions": [
        "evidencia insuficiente",
        "fuente no verificable"
      ],
      "evidence": [
        "claims ledger",
        "source report"
      ],
      "handoff": [
        "research to narrative"
      ],
      "prompt_version": "1.1.0"
    },
    {
      "role_id": "NARRATIVE_ARCHITECTURE",
      "contract_type": "BASE_RESPONSIBILITY",
      "functional_owner": "SCRIPT_PRODUCT",
      "purpose": "Convertir el diseño editorial validado en propuestas de recorrido y estructura narrativa.",
      "when_used": "Después de investigación y antes de redacción.",
      "inputs": [
        "validated M1/M2 artifacts",
        "user instructions",
        "target duration",
        "target language"
      ],
      "outputs": [
        "ViewerJourneyProposal",
        "OpeningDesignProposal",
        "ClosingDesignProposal",
        "NarrativePlanProposal"
      ],
      "read_permissions": [
        "research artifacts",
        "brief",
        "RefinedThesis (read-only)",
        "EditorialScriptPromise (read-only)"
      ],
      "write_permissions": [
        "cognitive narrative proposals only"
      ],
      "forbidden_actions": [
        "alterar fuentes",
        "crear ThesisArtifact",
        "refinar RefinedThesis",
        "reformular la tesis aprobada de M2",
        "alterar EditorialScriptPromise",
        "aprobar su propia entrega"
      ],
      "veto_conditions": [
        "tesis sin soporte",
        "estructura incompleta"
      ],
      "evidence": [
        "viewer journey proposal",
        "opening and closing proposals",
        "narrative plan proposal"
      ],
      "handoff": [
        "plan to writing"
      ],
      "prompt_version": "1.0.0"
    },
    {
      "role_id": "INDEPENDENT_RESEARCH_AUDITOR",
      "contract_type": "BASE_RESPONSIBILITY",
      "functional_owner": "SCRIPT_PRODUCT",
      "purpose": "Auditar de forma independiente la cadena de investigación Research y sus límites antes del handoff posterior.",
      "when_used": "En M6, después de la consolidación post-deep y antes de cualquier handoff posterior.",
      "inputs": [
        "ResearchPlan",
        "ResearchPack",
        "SourceAccessAndEvidenceReport",
        "ResearchB2ExecutionManifest",
        "ResearchM4ExecutionManifest",
        "ResearchM5ExecutionManifest",
        "ClaimsLedger",
        "ResearchComparison",
        "RefinedThesis",
        "WorkResearchDossierCollection",
        "ResearchStopDecisionCollection"
      ],
      "outputs": [
        "IndependentResearchAudit",
        "ResearchReadyManifest"
      ],
      "read_permissions": [
        "research artifacts",
        "execution provenance"
      ],
      "write_permissions": [
        "independent audit artifacts"
      ],
      "forbidden_actions": [
        "modificar artefactos auditados",
        "aprobar B5-I2 o B5-I3",
        "iniciar REAL_AI",
        "declarar uso productivo"
      ],
      "veto_conditions": [
        "evidencia insuficiente",
        "provenance no verificable",
        "dependencia stale o invalidated",
        "auditoría incompleta"
      ],
      "evidence": [
        "independent research audit",
        "research ready manifest"
      ],
      "handoff": [
        "research audit to next authorized phase"
      ],
      "prompt_version": "1.1.0"
    },
    {
      "role_id": "WRITING",
      "contract_type": "BASE_RESPONSIBILITY",
      "functional_owner": "SCRIPT_PRODUCT",
      "purpose": "Redactar el guion conforme al perfil y plan aprobados.",
      "when_used": "Con inputs narrativos completos.",
      "inputs": [
        "narrative_plan",
        "thesis_artifact",
        "editorial_profile"
      ],
      "outputs": [
        "script_draft"
      ],
      "read_permissions": [
        "narrative artifacts",
        "active profile"
      ],
      "write_permissions": [
        "script draft"
      ],
      "forbidden_actions": [
        "saltarse gates",
        "declarar aprobación"
      ],
      "veto_conditions": [
        "perfil ausente",
        "input obligatorio ausente"
      ],
      "evidence": [
        "version manifest",
        "script"
      ],
      "handoff": [
        "draft to editor"
      ],
      "prompt_version": "1.0.0"
    },
    {
      "role_id": "EDITOR",
      "contract_type": "BASE_RESPONSIBILITY",
      "functional_owner": "SCRIPT_PRODUCT",
      "purpose": "Editar el guion y documentar correcciones.",
      "when_used": "Después de una redacción completa.",
      "inputs": [
        "script_draft",
        "editorial_profile"
      ],
      "outputs": [
        "edited_script",
        "EditorialEditReport"
      ],
      "read_permissions": [
        "script",
        "profile",
        "brief"
      ],
      "write_permissions": [
        "script",
        "EditorialEditReport"
      ],
      "forbidden_actions": [
        "autoaprobar",
        "borrar trazabilidad"
      ],
      "veto_conditions": [
        "defecto crítico no corregido",
        "cambio sin reporte"
      ],
      "evidence": [
        "EditorialEditReport",
        "diff"
      ],
      "handoff": [
        "edited script to final audit"
      ],
      "prompt_version": "1.0.0"
    },
    {
      "role_id": "FINAL_EDITORIAL_AUDITOR",
      "contract_type": "BASE_RESPONSIBILITY",
      "functional_owner": "SCRIPT_PRODUCT",
      "purpose": "Auditar de forma independiente el producto editorial final.",
      "when_used": "Tras edición y en contexto limpio.",
      "inputs": [
        "edited_script",
        "EditorialEditReport",
        "profile",
        "brief"
      ],
      "outputs": [
        "FinalEditorialAudit"
      ],
      "read_permissions": [
        "all approved inputs"
      ],
      "write_permissions": [
        "FinalEditorialAudit"
      ],
      "forbidden_actions": [
        "modificar el guion auditado",
        "auditar su propia edición"
      ],
      "veto_conditions": [
        "incumplimiento crítico",
        "evidencia ausente"
      ],
      "evidence": [
        "PASS|WARN|FAIL|BLOCKED",
        "correction route"
      ],
      "handoff": [
        "audit to owner decision"
      ],
      "prompt_version": "1.0.0"
    },
    {
      "role_id": "SCRIPT_PRODUCT_AUDITOR",
      "contract_type": "BASE_RESPONSIBILITY",
      "functional_owner": "SCRIPT_PRODUCT",
      "purpose": "Auditar de forma independiente los artefactos B5-I2 sin modificarlos ni aprobar su uso funcional.",
      "when_used": "Solo mediante la ruta B5-I2 autorizada y con contexto independiente.",
      "inputs": [
        "b5_i1_package",
        "narrative_human_analyses",
        "material_curation",
        "refined_thesis",
        "editorial_script_promise",
        "producer_run_reference",
        "artifact_checksums"
      ],
      "outputs": ["semantic_audit"],
      "read_permissions": ["B5-I2 artifacts", "active editorial profile", "producer provenance"],
      "write_permissions": ["semantic_audit only"],
      "forbidden_actions": ["modificar artefactos auditados", "autoaprobar", "autorizar B5-I3", "declarar ejecucion real"],
      "veto_conditions": ["evidencia insuficiente", "contexto no independiente", "checksum no verificable", "provenance ausente"],
      "evidence": ["semantic audit", "artifact checksums", "independent auditor run"],
      "handoff": ["semantic audit to B5-I2 gate"],
      "prompt_version": "1.0.0"
    },
    {
      "role_id": "CHANNEL_INTELLIGENCE_PRODUCER",
      "contract_type": "BASE_RESPONSIBILITY",
      "functional_owner": "CHANNEL_INTELLIGENCE",
      "purpose": "Evaluar la pertenencia temática y cerrar una recomendación para revisión independiente.",
      "when_used": "Antes de desarrollar un episodio real.",
      "inputs": [
        "topic_belonging_input",
        "active_editorial_profile",
        "initial_evidence"
      ],
      "outputs": [
        "TopicBelongingAssessment"
      ],